{
  "spec": "authorized-retailers/0.4",
  "feed": "revocations",
  "issued": "2026-09-28T14:02:00Z",
  "valid_until": "2026-09-28T14:17:00Z",
  "stale_until": "2026-09-29T14:02:00Z",
  "entries": [],
  "signature": {
    "kid": "ar-20260928-6e37",
    "jws": "eyJhbGciOiJFZERTQSIsImtpZCI6ImFyLTIwMjYwOTI4LTZlMzcifQ..c2lnbmF0dXJlLXBsYWNlaG9sZGVy"
  }
}
